{
  "schema": "mdoc-presentations-v1.schema.json",
  "mdoc": "a36776657273696f6e63312e3069646f63756d656e747381a367646f6354797065756f72672e69736f2e31383031332e352e312e6d444c6c6973737565725369676e6564a26a6e616d65537061636573a1716f72672e69736f2e31383031332e352e3185d818585aa4686469676573744944181a6672616e646f6d5072c7af2649d05a38b02e7e1cc7f9d04671656c656d656e744964656e7469666965726b66616d696c795f6e616d656c656c656d656e7456616c75656a4d75737465726d616e6ed818585ba46864696765737449440a6672616e646f6d50fc8a8f5bafb40cb321776dbf5fbe188171656c656d656e744964656e7469666965726a62697274685f646174656c656c656d656e7456616c7565d903ec6a313937312d30392d3031d818585ba4686469676573744944146672616e646f6d5059cddd91d753ed98ff555d2f9727453b71656c656d656e744964656e7469666965726a69737375655f646174656c656c656d656e7456616c7565d903ec6a323032342d30332d3135d818584ba46864696765737449440f6672616e646f6d50ccdc598ca9afee95fd57683eb19aff3371656c656d656e744964656e746966696572666865696768746c656c656d656e7456616c756518afd818584fa4686469676573744944156672616e646f6d50ac50f651bc04f001d02163847c9f1cc971656c656d656e744964656e7469666965726b6167655f6f7665725f31386c656c656d656e7456616c7565f56a697373756572417574688443a10126a118215902833082027f30820225a00302010202103500ba9befd91cb9da7905ffef18be8a300a06082a8648ce3d0403023039310b3009060355040613025554312a302806035504030c214f5746204964656e746974792043726564656e7469616c20544553542049414341301e170d3234303930323137323131335a170d3235303930323137323131335a30373128302606035504030c1f4f5746204964656e746974792043726564656e7469616c2054455354204453310b30090603550406130255543059301306072a8648ce3d020106082a8648ce3d03010703420004dc1c1f55cff4cd5c76cf4169278f7217667f86ee81d8669b63f2e19bc12a0c9f12355dd0385fed3bc33bedc9781b9aad47b33e4c24704b8d14288b1b3cb45c28a382010f3082010b301d0603551d0e041604141309ce860b9dffbc8599283a1dd9c1f3556a63f1301f0603551d230418301680143cc046990e934285466df6c6e09ae3e368df2b0e300e0603551d0f0101ff04040302078030150603551d250101ff040b3009060728818c5d05010230540603551d1f044d044b30493047a045a043864168747470733a2f2f6769746875622e636f6d2f6f70656e77616c6c65742d666f756e646174696f6e2d6c6162732f6964656e746974792d63726564656e7469616c304c0603551d1204450443864168747470733a2f2f6769746875622e636f6d2f6f70656e77616c6c65742d666f756e646174696f6e2d6c6162732f6964656e746974792d63726564656e7469616c300a06082a8648ce3d0403020348003045022100cc612db2da22609bf0a9ebea39a90574fac6d1b0ed8b8be045273ec7276f640c02207f214430134554409353b4b74c4b64526415816d2fcb4329570c62d556272b545906dbd8185906d6a66776657273696f6e63312e306f646967657374416c676f726974686d675348412d32353667646f6354797065756f72672e69736f2e31383031332e352e312e6d444c6c76616c756544696765737473a2716f72672e69736f2e31383031332e352e31b822181a58202cb73e3ec284c07643cb0cf5df2dc0ac83f8b236b3a9b732b68e4b3b6446f579181c58209bbe8085236ed036890f9b03f018531c33b24b34b2952de6db791f3902c4a66d0a58205bdea43a31d178c3c72fec44c71be515a2689627be2d3e715c3bba4e2578533414582055e0e05ec0d6e25920f46e64286ca981f4fcbae9a0bcbd8b893a225d94a6c694165820c8f2ef54bfa6b81967f478b5a7a9ee3664f600ac8d289fefd6a803d1107aa6b0181f58206a936bd34823ee83209d764d1e5d38a70c0df2089371cbb9844cfff9b5c5c8ef182758201a40412df181552de9b541744666049a869fb27e2d5886f7a99728ebb8b9443007582038b16990b9fc76f23a8516690a28a82279d2cbd96cdfd889e42bacbf06b9f05218255820e78b0363130b2c0cd887031d420bc9d386870535fb1673ccd86acb83de2a107c182158208990f0dc1aded7a46134812c440fc08bebaafbf472bd298df28f1c65bdd007df085820751e3b24efb32f7408112b12e886ec4cf61761562f5abd5ae571c73072306cd9035820520957176a822a519447d615234bcd6b972a7154f2a469992b2ec186291819580f58207f492ecdade9b015f19e9656b7cb4f27d96840eed5342664dcd223d15641a81b1358209d2cf053979a21622db91395f78aaf5b9c92391653d8c5bb4268a6408396fe28045820f797dfe40f5d9a616c9d26f374225156a09e61aea4a438606818d4bd2ce618b00c5820e59537ec38e7a78fe9e8c0e8a81881e7c1e92f1117b6297acff17c8e74d0ad120958206f7fb1df352f232f259ac0a4ee3976093a324fd1b1a1f315b2481d40a0697cc51818582070585866abf1c5fb60d5f4b09aa8abb9f9522a142dc354a11cbeb858f61ca140065820b7602785ef55319c6ef1d3ea6f361da9e1f0045013cd2f74a1d8247d1a7586be125820c19adf464a9b22c579c056bb0e4598b890a0bb1683b729067fa82c5e6a103d2d181b58209497fab1cba46ce410909f5db0eada49c5f0195ecb03220de9ba88c961c4bbf80058205b225aa1c6316acfed2be67015ed71c2da4d873f01a2fdd4d62fb30123386dc80e5820cf32748e98fb6b9dee3d48421fb5f6b45024ae4687892579aa05e3102460218015582071cd467c9c1c7a0c889506e97e1335e0ffb81fd19d8d5c848d74d70231abfa821820582088225186c941c805eaff639da5af04aaf0e9ad7cb484b166669432ed65f63d5218265820c6ba1f9966d525515dc90c483f9325fe3d8d083e2c58b685972b308b4da43e310d582033b6fc44ed6873543711f5e7979defe9a71a1b4a254f9164f4fc37ffb8004850181d58203e1ffd365a73b69e8ee37ed91ac27f79a13700a7bc2efec0ad0cced1deb5bebf181e58204089a1716a4ad5b9d0f6d518d385d52f77a20d504616f9c588bd60c614cd248a115820821ea80b1b533bf32c6c0fcedf789d92ace278c868230670e341f951fa150baa015820a58a7be3896c72b3ce94e2c8f823840ec6e2d0e32f9e27ce4d51fb3ee17c59d7025820e4eb6b2d3c36d354fe1ee28189294979828482e302648b42d64f89d897022e11175820a313f26cb625d2522025f33351175ca09ae54da5ee6a7505a540ef553cdd60290b58209647f0f8bc91d5c2b24817b6e00d7afb2fa4e78f4ccea315ebfc01c44aa013d6776f72672e69736f2e31383031332e352e312e61616d7661a618195820a6a9095ca857c0294d81508b26d659a773af30fc24215ab2df92e21e8fe7bffb055820fcbadd35f13af153aaf1727b3fd68677fc5d52bbefc0d79d1c35f347d6d0ce8c182358208b09aeb3d67d66b9e2655a4f4fe90e2b16426681927c05cb278be54b6aca893e1058209bcd902b6bcf9da870c1484f145323fc84a264d4224137521c0353c48c22c3ab182458200fd3d988ef7c640cc483f123cb0beb0c49aa6eddae96ec17af66586b05167355182258204587e36a169a71d6f251fa39686981229e97e646c9843c1b5a1391db036bd2c06d6465766963654b6579496e666fa1696465766963654b6579a401022001215820531a86bdc5aea7b4bff11208efb5c5a7db1b0017c020d7d9f6bf892d47a617d122582024ac7274f7e6a10a3956b92e5ac2f8ab53cd8ab3b43822ab1d05904f3b50b2d66c76616c6964697479496e666fa3667369676e6564c074323032342d30392d33305431333a35303a30305a6976616c696446726f6dc074323032342d30392d33305431333a35303a30305a6a76616c6964556e74696cc074323032342d31302d33305431333a35303a30305a5840c99bd413f88dd3f154e5827010e34314b4412d4d251aed28daaee223360a9dcc9fe945087e56c9a54db67a0ae3d7e1a62efa63c3097454a0e782fa0577e5c4dc6c6465766963655369676e6564a26a6e616d65537061636573d81841a06a64657669636541757468a16f6465766963655369676e61747572658443a10126a0f6584083ef0e35d8c53692b71e9aea4c28abacd4f8501d4921822d24d1d4826b2e4ee50d2c3d35ac4af2df954e3a29728aadb79bdd86c625e9d67ab90cbd7cd07ae13c6673746174757300",
  "transcript": "83f6f6847142726f7773657248616e646f76657276315820f93ebac4ce4d9901b9aea472145ae5421f8fbecbe5f0389683f59f08fcf90e455833a363636174016474797065016764657461696c73a1676261736555726c75687474703a2f2f6c6f63616c686f73743a3830383058203c79914b7f81a1c2558fc81619dd4a074d32143e6cf6895fe47da156d1c5b0ae",
  "provenance": {
    "type": "repository",
    "repo": "github.com/abetterinternet/zk-cred-longfellow",
    "ref": "b22d84e9cba4e1acbff29fdbe4d5cbf5cc902a70",
    "path": "test-vectors/mdoc_zk/v6_v7_1attr_issue_date.json"
  },
  "doctype": "org.iso.18013.5.1.mDL",
  "issuer_public_key_x": "dc1c1f55cff4cd5c76cf4169278f7217667f86ee81d8669b63f2e19bc12a0c9f",
  "issuer_public_key_y": "12355dd0385fed3bc33bedc9781b9aad47b33e4c24704b8d14288b1b3cb45c28",
  "device_namespaces": "a0"
}
