{
  "schema": "mdoc-presentations-v1.schema.json",
  "doctype": "eu.europa.ec.av.1",
  "mdoc": "a36776657273696f6e63312e3069646f63756d656e747381a367646f63547970657165752e6575726f70612e65632e61762e316c6973737565725369676e6564a26a6e616d65537061636573a17165752e6575726f70612e65632e61762e3181d818584fa46672616e646f6d502d5e6cc72127bbdb78044a97bff290286864696765737449440071656c656d656e744964656e7469666965726b6167655f6f7665725f31386c656c656d656e7456616c7565f56a697373756572417574688443a10126a1182159015e3082015a30820100a00302010202140f7aa97f3694916fd340de14592eea2c11765c8e300a06082a8648ce3d04030230233121301f06035504030c1870796c6f6e6766656c6c6f77207465737420697373756572301e170d3236303830313030303030305a170d3237303830313030303030305a30233121301f06035504030c1870796c6f6e6766656c6c6f772074657374206973737565723059301306072a8648ce3d020106082a8648ce3d0301070342000419c97d716b6f045ae00c23bfa889640f04bc159b07dbbcfb2c55e257341c179b3593cc05ab614499a3dfb575167c1a68348a8fa3293e98a2b17acbfcda7e62f4a3123010300e0603551d0f0101ff040403020780300a06082a8648ce3d0403020348003045022044796e062cd1aeedcb1c2e546fdea60d0d04e3af186f5bd9bab7407b4988a419022100f0a8f40ef3245edf45ba62d89ce6f872d848ad0db3f878692ad43baf0a794113590158d818590153a667646f63547970657165752e6575726f70612e65632e61762e316776657273696f6e63312e306f646967657374416c676f726974686d675348412d3235366c76616c756544696765737473a17165752e6575726f70612e65632e61762e31a100582060ceccfbf1a40ce7c09071141ab3b455ca3b970de1d2dd175986ec83e36c6b776d6465766963654b6579496e666fa1696465766963654b6579a401022001215820b69dc8ac0c26ecbd8278d707b02144786cc3f5c992f0db8b11437ccbe8516bf92258200bd81ce301d2f9b7cff1ff75889fb0165403577452ce91addb41dd915afff94e6c76616c6964697479496e666fa3667369676e6564c074323032362d30382d30315430303a30303a30305a6976616c696446726f6dc074323032362d30382d30315430303a30303a30305a6a76616c6964556e74696cc074323032372d30382d30315430303a30303a30305a584090781a4f5fe0f30c0a3034002fd75c7039bb0d684c6e2d5d42c0e77342d7444ff7aa8a1869f245a1051204d6c14178c868a957b7544268f9ba1fbdcf3f9037f76c6465766963655369676e6564a26a6e616d65537061636573d81841a06a64657669636541757468a16f6465766963655369676e61747572658443a10126a0f6584010eeaf2b327e6a27e51a4fd4525e0d9265c25ac67c6dc873f8b015e792e879d9b49344c1a6009f597e7bdcffad1ef2a8d784a04f286d2af38359a8f1e2ca652f6673746174757300",
  "device_namespaces": "a0",
  "transcript": "83f6f68265646361706958200000000000000000000000000000000000000000000000000000000000000000",
  "issuer_public_key_x": "19c97d716b6f045ae00c23bfa889640f04bc159b07dbbcfb2c55e257341c179b",
  "issuer_public_key_y": "3593cc05ab614499a3dfb575167c1a68348a8fa3293e98a2b17acbfcda7e62f4",
  "provenance": {
    "type": "constructed",
    "generator": "tools/generation/generate.py presentation"
  },
  "comment": "Presentation over one age_over_18 claim, staged by the presentation command and used as the collection the prove and flip-bit tests read."
}
