{
  "schema": "mdoc-presentations-v1.schema.json",
  "mdoc": "a0",
  "provenance": {
    "type": "constructed",
    "generator": "fixture",
    "created": "2026-08-24"
  },
  "comment": "Presentation vector holding mdoc and provenance alone. Every content field is absent, and the one-byte mdoc makes claims() raise."
}
