{
  "schema": "mdoc-presentations-v1.schema.json",
  "mdoc": "a36776657273696f6e63312e3069646f63756d656e747381a367646f63547970657165752e6575726f70612e65632e61762e316c6973737565725369676e6564a26a6e616d65537061636573a17165752e6575726f70612e65632e61762e3181d818584fa46672616e646f6d505823b70dea4fff0fc45aff7deb8233d06864696765737449440071656c656d656e744964656e7469666965726b6167655f6f7665725f31386c656c656d656e7456616c7565f56a697373756572417574688443a10126a11821590146308201423081e9a003020102020102300a06082a8648ce3d04030230223120301e06035504030c176c6f6e6766656c6c6f772d766563746f72732d69616361301e170d3236303130313030303030305a170d3336303130313030303030305a3020311e301c06035504030c156c6f6e6766656c6c6f772d766563746f72732d64733059301306072a8648ce3d020106082a8648ce3d03010703420004e8118c66659f0a4a542316e04a392d2186faeb883c90aa8a7a4dbf38aa4961b43fb1b7483b826a7c9cf26c0f06d788a53ead6a3f365c42a3c67e51142e2af6cfa3123010300e0603551d0f0101ff040403020780300a06082a8648ce3d04030203480030450220154c644ecc496bce4dfbe29f2cdcf553f96f0bab73e1ed030081b4dbc6fb355c0221008fe1e4371adae4643852e95e0b0ae0838897a889303af0bf5464175a2bf60a09590158d818590153a667646f63547970657165752e6575726f70612e65632e61762e316776657273696f6e63312e306f646967657374416c676f726974686d675348412d3235366c76616c756544696765737473a17165752e6575726f70612e65632e61762e31a10058204ad6f32fe20957d2c083d5195e30bc52150c4130e502fbe9b54e6b6a85ea99276d6465766963654b6579496e666fa1696465766963654b6579a4010220012158203c37d5ff88be8fd69de39dbfa90f2588795016c55db78a351705b34d9d6f5a36225820b671d93ff661f73490b7731a2b2bee0c2037a9935423781ed756b999f6f9e1e36c76616c6964697479496e666fa3667369676e6564c074323032362d30312d30315430303a30303a30305a6976616c696446726f6dc074323032362d30312d30315430303a30303a30305a6a76616c6964556e74696cc074323032382d30312d30315430303a30303a30305a5840a2cfbf75e5e43f18372ae9c64e87b1313df6df7a8805e2396f3c161b87fe81b952ba925c20a5fe1b6d4e1277bb5960674f9ebca47caf07a52705f7fd902073ae6c6465766963655369676e6564a26a6e616d65537061636573d818581fa17165752e6575726f70612e65632e61762e31a1636e796d666e796d2d30316a64657669636541757468a16f6465766963655369676e61747572658443a10126a0f65840e42cd3b216812b6e281fd5d8e2521b4cb5f94543b6c667fce35b51b674cc6b8ba2294bc0f680a6f3f0f82c776d3512fa7c6996507f904abd2a7eefa2172ed04b6673746174757300",
  "transcript": "83f6f68265646361706958200000000000000000000000000000000000000000000000000000000000000000",
  "provenance": {
    "type": "constructed",
    "generator": "generate.py presentation --name av-over-18-device-namespaces-nonempty --credential av-over-18 --transcript 83f6f68265646361706958200000000000000000000000000000000000000000000000000000000000000000 --device-namespace eu.europa.ec.av.1 nym '\"nym-01\"'"
  },
  "doctype": "eu.europa.ec.av.1",
  "issuer_public_key_x": "e8118c66659f0a4a542316e04a392d2186faeb883c90aa8a7a4dbf38aa4961b4",
  "issuer_public_key_y": "3fb1b7483b826a7c9cf26c0f06d788a53ead6a3f365c42a3c67e51142e2af6cf",
  "device_namespaces": "a17165752e6575726f70612e65632e61762e31a1636e796d666e796d2d3031",
  "credential": "av-over-18"
}
