{
  "schema": "mdoc-presentations-v1.schema.json",
  "mdoc": "a36776657273696f6e63312e3069646f63756d656e747381a367646f6354797065756f72672e69736f2e31383031332e352e312e6d444c6c6973737565725369676e6564a26a6e616d65537061636573a1716f72672e69736f2e31383031332e352e3182d8185840a4686469676573744944006672616e646f6d410071656c656d656e744964656e7469666965726b6167655f6f7665725f31386c656c656d656e7456616c7565f5d8185849a4686469676573744944016672616e646f6d410071656c656d656e744964656e7469666965726a69737375655f646174656c656c656d656e7456616c75656a323032362d30312d30316a69737375657241757468406c6465766963655369676e6564a06673746174757300",
  "provenance": {
    "type": "constructed",
    "generator": "fixture",
    "created": "2026-08-24"
  },
  "comment": "Presentation vector whose mdoc is a synthetic DeviceResponse holding age_over_18 and issue_date, for the claims() tests."
}
